{
  "schema": "agent-receipt/v0",
  "id": "omsocll-proofslip-pr-12-aaf538a",
  "created_at": "2026-10-20T16:17:26Z",
  "repo": "omsocll/proofslip",
  "pr": {
    "number": 12,
    "url": "https://github.com/omsocll/proofslip/pull/12",
    "head_sha": "aaf538a4156088fe143807df64d4ceabf9f70f71",
    "author": "omsocll"
  },
  "agent": {
    "name": "Cursor",
    "detected_by": "body_marker"
  },
  "task": {
    "source": "pr",
    "text": "Check the built site for email addresses"
  },
  "changes": {
    "files_changed": 1,
    "additions": 5,
    "deletions": 2,
    "files": [
      "tests/website.test.ts"
    ]
  },
  "claims": [],
  "red_flags": [
    {
      "kind": "assertions_removed",
      "summary": "Removed assertions from tests without replacing them: `tests/website.test.ts` (2 removed, 1 added).",
      "files": [
        "tests/website.test.ts"
      ]
    }
  ],
  "overall": "doesnt_match",
  "summary_plain": "Cursor was asked to check the built site for email addresses. 1 file changed (5 lines added, 2 removed). There is a warning sign: Removed assertions from tests without replacing them: `tests/website.test.ts` (2 removed, 1 added). This receipt does not match the agent's account.",
  "unverified": [],
  "generator": {
    "name": "proofslip",
    "version": "0.1.1"
  }
}
