{
  "schema": "agent-receipt/v0",
  "id": "omsocll-proofslip-pr-3-946d66d",
  "created_at": "2026-10-19T10:41:15Z",
  "repo": "omsocll/proofslip",
  "pr": {
    "number": 3,
    "url": "https://github.com/omsocll/proofslip/pull/3",
    "head_sha": "946d66d06c78a1bdf409d971f8e5e851ab41c198",
    "author": "omsocll"
  },
  "agent": {
    "name": "omsocll",
    "detected_by": "label"
  },
  "task": {
    "source": "pr",
    "text": "Demo: honest receipt (count label helper)"
  },
  "changes": {
    "files_changed": 3,
    "additions": 22,
    "deletions": 4,
    "files": [
      "src/present.ts",
      "src/text.ts",
      "tests/text.test.ts"
    ]
  },
  "claims": [
    {
      "id": "c1",
      "text": "Added `countLabel` in `src/text.ts` and called it from `src/present.ts`",
      "type": "file_changed",
      "verdict": "confirmed",
      "evidence": [
        {
          "kind": "diff",
          "file": "src/text.ts"
        },
        {
          "kind": "diff",
          "file": "src/present.ts"
        }
      ]
    },
    {
      "id": "c2",
      "text": "Added tests",
      "type": "added_tests",
      "verdict": "confirmed",
      "evidence": [
        {
          "kind": "diff",
          "file": "tests/text.test.ts"
        }
      ]
    },
    {
      "id": "c3",
      "text": "All tests pass",
      "type": "tests_pass",
      "verdict": "confirmed",
      "evidence": [
        {
          "kind": "check_run",
          "name": "test",
          "conclusion": "success",
          "sha": "946d66d06c78a1bdf409d971f8e5e851ab41c198",
          "url": "https://github.com/omsocll/proofslip/actions/runs/39238389684/job/118012960092"
        }
      ]
    }
  ],
  "red_flags": [],
  "overall": "checks_out",
  "summary_plain": "omsocll was asked to demo: honest receipt (count label helper). 3 files changed (22 lines added, 4 removed). What we could check matches what the agent said.",
  "unverified": [],
  "generator": {
    "name": "proofslip",
    "version": "0.1.0"
  }
}
